{
  "schema_version": "1.0",
  "shop_id": "shop_dev",
  "session_id": "sess_0123456789",
  "sent_at": 1790000200000,
  "events": [
    {
      "type": "outcome",
      "event_id": "evt_oc_00000002",
      "ts": 1790000100000,
      "kind": "checkout_started",
      "value": null,
      "source": "pixel"
    }
  ]
}
