{
  "schema_version": "1.0",
  "shop_id": "shop_dev",
  "visitor_hash": "aaaaaaaaaaaaaaaaaaaaaaaaaaaaaaaaaaaaaaaaaaaaaaaaaaaaaaaaaaaaaaaa",
  "session_id": "sess_0123456789",
  "page_id": "page_0123456789",
  "sent_at": 1790000000000,
  "events": [
    {
      "type": "rule_fired",
      "event_id": "evt_rf_00000001",
      "ts": 1790000042000,
      "decision_id": "dec_0123456789",
      "friction_state": "delivery_uncertainty",
      "rule_id": "delivery_v1",
      "rule_version": "r1",
      "fire_seq": 1,
      "arm": "holdout",
      "mode": "shadow",
      "play": null,
      "propensity": null,
      "content_ref": "shipping_eta:DE",
      "has_content": true,
      "features": {
        "shipping_page_visited": true,
        "shipping_block_dwell_s": 41.5,
        "scroll_reversals_30s": 2,
        "page_type": "product",
        "device": "mobile",
        "cart_value": 59.9,
        "product_id": "4821",
        "country": "DE"
      }
    },
    {
      "type": "page_summary",
      "event_id": "evt_ps_00000001",
      "ts": 1790000090000,
      "features": {
        "shipping_page_visited": true,
        "pages_viewed": 2,
        "cart_adds": 0
      },
      "eval_count": 37,
      "eval_p50_us": 80,
      "eval_max_us": 410
    }
  ]
}
